Salary1,Salary2,Job_Type,Skill,No_of_Skills,No_of_Reviews,No_of_Stars,Date_Since_Posted,Location,Revenue,Employees,Industry
less than80000,80000,data_scientist,"SAP, SQL",2,3301,3.299999952,1,MO,more than $10B ,"10,000+",Health Care
less than80000,80000,data_scientist,"Machine Learning, R, SAS, SQL, Python",5,,,15,TX,,,
less than80000,80000,data_scientist,"Data Mining, Data Management, R, SAS, SQL, STATA, SPSS, Data Analysis, Python",9,62,3.5,1,OR,,,
less than80000,80000,data_scientist,Certified Internal Auditor,1,158,4.300000191,30,DC,,,Government
less than80000,80000,data_scientist,"Statistical Software, Time Management, R, Microsoft Office, Excel, Tableau, Data Science",7,495,4.099999905,30,TX,,"less than 10,000",Banks and Financial Services
less than80000,80000,data_scientist,"AI, Quantitative Analysis, Data Mining, Machine Learning, Analysis Skills, CSS",6,173,4.300000191,30,MD,,,
less than80000,80000,data_scientist,"Statistical Software, Machine Learning, R, Image Processing, SQL, Cloud Computing, ArcGIS, GIS, Python, AWS",10,30,3.799999952,5,NY,,,Government
less than80000,80000,data_scientist,"Machine Learning, R, SQL",3,,,10,GA,,,
less than80000,80000,data_scientist,"Linux, R, C/C++, Python",4,233,4.199999809,1,ID,,,Education and Schools
less than80000,80000,data_scientist,"JavaScript, Data Mining, TS/SCI Clearance, R, C/C++, Python",6,4227,4.300000191,22,MO,,"10,000+",Government
less than80000,80000,data_scientist,"Machine Learning, R, SPSS, Data Analysis, Statistical Software, Data Mining, SAS, Python",8,541,4.199999809,1,PA,,,Education and Schools
less than80000,80000,data_scientist,"Machine Learning, R, SPSS, Data Analysis, Statistical Software, Data Mining, SAS, Python",8,541,4.199999809,1,PA,,,Education and Schools
less than80000,80000,data_scientist,"Machine Learning, Analysis Skills, Data Science",3,150,4.300000191,30,TX,less than $1B ,"less than 10,000",Education and Schools
less than80000,80000,data_scientist,"Machine Learning, Python",2,,,6,GA,,,
less than80000,80000,data_scientist,"TensorFlow, Project Planning, Linux, Machine Learning, C/C++, Python, Jira",7,81,3.200000048,30,GA,less than $1B ,"less than 10,000",Consulting and Business Services
less than80000,80000,data_scientist,"Machine Learning, R, Statisical Analysis, SPSS, Statistical Software, Data Mining, Scala, Tableau, Java, ""Drivers License"", Python",11,16,3.900000095,1,FL,,"less than 10,000",Education and Schools
less than80000,80000,data_scientist,"Machine Learning, R, SQL, Analysis Skills, Python, Data Science",6,,,30,MA,,,
less than80000,80000,data_scientist,"Microsoft SQL Server, Data Mining, Machine Learning, Visual Basic, R, SAS, SQL, Excel, Tableau, Microsoft Access, SPSS, Python",12,7197,4,30,VA,,"10,000+",Consulting and Business Services
less than80000,80000,data_scientist,Machine Learning,1,2234,4,11,NJ,more than $10B ,"10,000+",Energy and Utilities
less than80000,80000,data_scientist,"LMRT, Machine Learning",2,278,4.199999809,5,MA,,,Education and Schools
less than80000,80000,data_scientist,"AI, Data Mining, Machine Learning, R, Natural Language Processing, Data Science, Python",7,1299,3.900000095,30,LA,,"10,000+",Health Care
less than80000,80000,data_scientist,"IIS, TS/SCI Clearance",2,3166,4,30,MO,more than $10B ,"10,000+",Aerospace and Defense
less than80000,80000,data_scientist,"IIS, TS/SCI Clearance",2,3166,4,30,MO,more than $10B ,"10,000+",Aerospace and Defense
less than80000,80000,data_scientist,"Statistical Software, SAS, SQL, Tableau",4,265,4.099999905,30,NY,,,Government
less than80000,80000,data_scientist,"Microsoft SQL Server, Data Management, Power BI, CAD Software, SQL, Microsoft Access, SharePoint, ArcGIS",8,86,3.299999952,15,GA,,,Consulting and Business Services
less than80000,80000,data_scientist,"Data Mining, R, Python",3,7197,4,30,VA,,"10,000+",Consulting and Business Services
less than80000,80000,data_scientist,"AI, Data Mining, Machine Learning, R, Natural Language Processing, Data Science, Python",7,1299,3.900000095,30,LA,,"10,000+",Health Care
less than80000,80000,data_scientist,,0,2641,4.300000191,21,NY,more than $10B ,"10,000+",Internet and Software
less than80000,80000,data_scientist,,0,2641,4.300000191,21,MA,more than $10B ,"10,000+",Internet and Software
less than80000,80000,data_scientist,"TensorFlow, Machine Learning, Git, Python, SVN",5,111,4.300000191,2,CA,$1B to $5B ,"less than 10,000",Government
less than80000,80000,data_scientist,"TensorFlow, JavaScript, React, Data Mining, Adobe Photoshop, Machine Learning, CSS, HTML5",8,484,4.300000191,30,CA,$5B to $10B ,"10,000+",Internet and Software
less than80000,80000,data_scientist,"TensorFlow, Machine Learning, R, Python, C/C++, SQL",6,95,3.799999952,30,GA,,,
less than80000,80000,data_scientist,,0,2641,4.300000191,21,CA,more than $10B ,"10,000+",Internet and Software
less than80000,80000,data_scientist,"Machine Learning, Scripting, R, Perl, SQL, MATLAB, Python",7,930,4.199999809,30,MN,,,Education and Schools
less than80000,80000,data_scientist,,0,2641,4.300000191,21,WA,more than $10B ,"10,000+",Internet and Software
less than80000,80000,data_scientist,"Splunk, Data Mining, Machine Learning, Data Science",4,30,4.300000191,30,CA,,"less than 10,000",Internet and Software
less than80000,80000,data_scientist,Grant Writing,1,126,4.199999809,30,TX,,,Education and Schools
less than80000,80000,data_scientist,"Natural Language Processing, Hive, Spark, Microsoft Powerpoint, Machine Learning, Hadoop, MATLAB, Python",8,5178,4.199999809,5,WA,more than $10B ,"10,000+",Internet and Software
less than80000,80000,data_scientist,"Data Mining, Statisical Analysis, Qualitative Research",3,191,4,16,NC,,,Health Care
less than80000,80000,data_scientist,"Java, R, SAS, Python, SQL, Tableau",6,191,4,16,NC,,,Health Care
less than80000,80000,data_scientist,"AI, Quantitative Analysis, Microsoft SQL Server, Machine Learning, Visual Basic, R, SQL, .Net, C#, Python",10,165,3.599999905,30,IL,,"less than 10,000",Transport and Freight
less than80000,80000,data_scientist,"Big Data, Natural Language Processing, Spark, Machine Learning, Hadoop",5,63,3.900000095,30,CA,$1B to $5B ,"less than 10,000",Internet and Software
less than80000,80000,data_scientist,"TensorFlow, Machine Learning, Python",3,39,4.5,1,CA,,,
less than80000,80000,data_scientist,"Big Data, Natural Language Processing, Spark, Machine Learning, Hadoop",5,63,3.900000095,30,NY,$1B to $5B ,"less than 10,000",Internet and Software
less than80000,80000,data_scientist,"TensorFlow, Machine Learning, Image Processing, C/C++",4,,,30,CO,,,
less than80000,80000,data_scientist,"Machine Learning, Microsoft Powerpoint, Microsoft Office",3,1324,4.800000191,1,UT,,"10,000+",Organization
less than80000,80000,data_scientist,".Net, C#, Machine Learning, Software Development, MATLAB, Image Processing, Signal Processing, Python, C/C++",9,15,3.700000048,30,OH,less than $1B ,"less than 10,000",Aerospace and Defense
less than80000,80000,data_scientist,"AI, Machine Learning",2,,,18,CA,,,
80000-99999,90000,data_scientist,"Java, Data Mining, Machine Learning, Design Experience, Scripting, R, SAS, Python",8,23472,3.900000095,1,USA,,"10,000+",Consulting and Business Services
80000-99999,90000,data_scientist,"Pentaho, Excel",2,,,5,OR,,,
80000-99999,90000,data_scientist,Data Mining,1,8595,4,1,WA,more than $10B ,"10,000+",Telecommunications
80000-99999,90000,data_scientist,"Microsoft SQL Server, Data Mining, R, Oracle, SAS, SQL, DB2",7,157456,3.599999905,1,TX,more than $10B ,"10,000+",Retail
80000-99999,90000,data_scientist,,0,11,4.400000095,1,OH,,,
80000-99999,90000,data_scientist,"Natural Language Processing, Machine Learning",2,248,3.799999952,3,FL,$1B to $5B ,"10,000+",Energy and Utilities
80000-99999,90000,data_scientist,"AI, Next Generation Sequencing, Machine Learning, Bioinformatics",4,156,4.300000191,7,IL,,"10,000+",Government
80000-99999,90000,data_scientist,"Microsoft SQL Server, Data Mining, R, Oracle, SAS, SQL, DB2",7,157456,3.599999905,7,AR,more than $10B ,"10,000+",Retail
80000-99999,90000,data_scientist,,0,,,30,VA,,,
80000-99999,90000,data_scientist,".Net, Data Mining, C#, Machine Learning, R, C/C++, Python, SQL",8,5178,4.199999809,10,WA,more than $10B ,"10,000+",Internet and Software
80000-99999,90000,data_scientist,"Data Mining, Data Warehouse, R, SAS, Statisical Analysis, Python, SQL",7,8696,4,8,TX,more than $10B ,"10,000+",Computers and Electronics
80000-99999,90000,data_scientist,,0,,,30,VA,,,
80000-99999,90000,data_scientist,"Machine Learning, R, Microsoft Office, SQL, Alteryx, Data Warehouse, Python",7,4635,3.5,4,PA,$5B to $10B ,"10,000+",Retail
80000-99999,90000,data_scientist,"Machine Learning, R, Perl, C/C++, SQL, Big Data, SPSS, MATLAB, Data Mining, Ruby, Hadoop, SAS, Tableau, Java, Spark, Git, Python, Data Science",18,3006,3.900000095,10,MO,$1B to $5B ,"less than 10,000",Consumer Goods and Services
80000-99999,90000,data_scientist,"Machine Learning, R, Perl, SPSS, MATLAB, Statistical Software, Hadoop, SAS, Java, Python",10,5671,3.799999952,14,NC,more than $10B ,"10,000+",Insurance
80000-99999,90000,data_scientist,"R, Marketing, SAS, SQL, Python",5,381,4.199999809,15,ME,,,
80000-99999,90000,data_scientist,,0,282,4.199999809,30,CA,,,Education and Schools
80000-99999,90000,data_scientist,"Machine Learning, R, SAS, Python, SQL",5,197,3.900000095,13,IL,,,
80000-99999,90000,data_scientist,"Data Mining, Statisical Analysis, Customer Service",3,1296,4,4,NV,$5B to $10B ,"10,000+",Restaurants and Travel and Leisure
80000-99999,90000,data_scientist,"Java, AI, Machine Learning",3,27,3.299999952,30,CT,$1B to $5B ,"less than 10,000",Banks and Financial Services
80000-99999,90000,data_scientist,"Machine Learning, R, Perl, SPSS, MATLAB, Statistical Software, Hadoop, SAS, Java, Python",10,5671,3.799999952,30,WA,more than $10B ,"10,000+",Insurance
80000-99999,90000,data_scientist,"Predictive Analytics, Hive, Spark, Machine Learning, Python, SQL, AWS",7,322,3.299999952,28,REMOTE,less than $1B ,"less than 10,000",Internet and Software
80000-99999,90000,data_scientist,"Business Intelligence, Data Mining, Machine Learning, R, SAS, Sentiment Analytics, SQL, SPSS, Data Science, Python",10,198,3.900000095,13,RI,,"less than 10,000",Insurance
80000-99999,90000,data_scientist,"Machine Learning, Data Management, MATLAB, R, SAS",5,2433,3.799999952,4,PA,more than $10B ,"10,000+",Health Care
80000-99999,90000,data_scientist,"JavaScript, Machine Learning, XML, Hadoop, R, SQL, HTML5, Shell Scripting, CSS, Python, AWS",11,,,13,NY,,,
80000-99999,90000,data_scientist,"JavaScript, Machine Learning, XML, Hadoop, R, SQL, HTML5, Shell Scripting, CSS, Python, AWS",11,,,13,NY,,,
80000-99999,90000,data_scientist,"Data Mining, Excel",2,32,4.599999905,5,VA,less than $1B ,"less than 10,000",Organization
80000-99999,90000,data_scientist,"Data Mining, R, SAS, Sentiment Analytics, Microsoft Office, Tableau, Natural Language Processing, Python, Data Science",9,7197,4,23,FL,,"10,000+",Consulting and Business Services
80000-99999,90000,data_scientist,"Machine Learning, R, SAS, Microsoft Office, SQL",5,1005,3.200000048,19,TN,,"10,000+",Insurance
80000-99999,90000,data_scientist,"Business Intelligence, Power BI, Tableau",3,3842,3.900000095,11,FL,more than $10B ,"10,000+",Insurance
80000-99999,90000,data_scientist,"AI, Machine Learning, R, Python, SQL, Tableau",6,181,3.799999952,30,NY,,"less than 10,000",Media and News and Publishing
80000-99999,90000,data_scientist,"Data Mining, Machine Learning, Project Management, Azure, Google Cloud Platform, SAS, SQL, Cloud Computing, Data Warehouse, Python, AWS",11,2550,3.5,20,MA,more than $10B ,"10,000+",Retail
80000-99999,90000,data_scientist,"Data Mining, Machine Learning, R, Python, SQL",5,,,30,TX,,,
80000-99999,90000,data_scientist,"Data Mining, Machine Learning, R, Python, Excel, SQL",6,17,3.799999952,28,WA,less than $1B ,"less than 10,000",Consumer Goods and Services
80000-99999,90000,data_scientist,"MySQL, Machine Learning, R, Python",4,3,1.299999952,30,WI,,,
80000-99999,90000,data_scientist,"Data Mining, Tableau",2,11,4.5,18,DC,,"less than 10,000",
80000-99999,90000,data_scientist,"Salesforce CRM, Pardot, Marketing Automation, SQL",4,,,30,SC,,,
80000-99999,90000,data_scientist,"Certified Internal Auditor, UI",2,158,4.300000191,30,DC,,,Government
80000-99999,90000,data_scientist,"Statistical Software, R, SAS, Microsoft Office, Excel, SQL, Big Data, Alteryx, SPSS, MATLAB, Six Sigma Certification, Six Sigma, Google Suite, Python",14,998,3.599999905,30,MO,,,Retail
80000-99999,90000,data_scientist,"Machine Learning, R, SQL, MATLAB, Python, Signal Processing",6,3285,4.099999905,6,IL,more than $10B ,"10,000+",Health Care
80000-99999,90000,data_scientist,"Perl, Statisical Analysis, C/C++, Java, Troubleshooting, Python",6,130,4.199999809,7,CA,,,Government
80000-99999,90000,data_scientist,".Net, C#, Machine Learning",3,,,30,MA,,,
80000-99999,90000,data_scientist,"Microsoft SQL Server, Microsoft Powerpoint, Visual Basic, SAP, SQL, Tableau, Six Sigma Certification",7,184,4,13,MI,$5B to $10B ,"less than 10,000",Energy and Utilities
80000-99999,90000,data_scientist,"Data Mining, Machine Learning",2,732,4.400000095,30,PA,,"less than 10,000",Education and Schools
80000-99999,90000,data_scientist,"Business Intelligence, SQL, Excel, Microsoft Access",4,27,3.099999905,30,NY,,,
80000-99999,90000,data_scientist,"Machine Learning, Visual Basic, R, Oracle, C/C++, SQL, Java, Python",8,81,3.5,30,NY,,,Banks and Financial Services
80000-99999,90000,data_scientist,"JavaScript, Spark, Machine Learning, Hadoop, Data Science",5,56,4.099999905,30,CA,,"less than 10,000",Internet and Software
80000-99999,90000,data_scientist,"Data Mining, Machine Learning, R, Python, SQL",5,32,2.700000048,30,KY,,"less than 10,000",Insurance
80000-99999,90000,data_scientist,"Machine Learning, Python, SQL, AWS",4,,,28,MA,,,
80000-99999,90000,data_scientist,"Linux, Data Mining, R, Python, SQL",5,44,3.200000048,12,AZ,,,
80000-99999,90000,data_scientist,"Machine Learning, R, SAS, SQL, Customer Service, Teradata",6,1296,4,19,NV,$5B to $10B ,"10,000+",Restaurants and Travel and Leisure
80000-99999,90000,data_scientist,"Microsoft Powerpoint, Visual Basic, R, Python, SQL, Microsoft Office, Tableau",7,3947,3.400000095,5,FL,$1B to $5B ,"10,000+",
80000-99999,90000,data_scientist,"Statistical Software, Data Mining, Microsoft SQL Server, Microsoft Powerpoint, R, Marketing, SAS, Oracle, Microsoft Office, Minitab, Teradata, STATA, SPSS, MATLAB, Python",15,8595,4,11,WA,more than $10B ,"10,000+",Telecommunications
80000-99999,90000,data_scientist,"Machine Learning, R, SQL",3,,,30,GA,,,
80000-99999,90000,data_scientist,"Linux, Data Mining, Machine Learning, R, SAS, SQL, Natural Language Processing, Python",8,663,4,25,PA,$1B to $5B ,"10,000+",Education and Schools
80000-99999,90000,data_scientist,"Machine Learning, R, Python, SQL",4,845,3.799999952,30,MA,more than $10B ,"less than 10,000",Banks and Financial Services
80000-99999,90000,data_scientist,"TensorFlow, Hive, Hadoop, R, Python, SQL",6,,,30,VA,,,
80000-99999,90000,data_scientist,"Data Mining, Machine Learning, R, SAS, Data Science, Python, SQL",7,81,3.200000048,29,IL,less than $1B ,"less than 10,000",Consulting and Business Services
80000-99999,90000,data_scientist,"Hive, Machine Learning, R, Python, SQL",5,484,4.300000191,25,UT,$5B to $10B ,"10,000+",Internet and Software
80000-99999,90000,data_scientist,"AI, Data Mining, Microsoft SQL Server, Machine Learning, R, SAS, SQL, Tableau, ACH, Six Sigma, Python, DB2",12,2153,3.700000048,9,NC,less than $1B ,"10,000+",Banks and Financial Services
80000-99999,90000,data_scientist,"JavaScript, Machine Learning, XML, Hadoop, R, SQL, HTML5, Shell Scripting, CSS, Python, AWS",11,,,30,NY,,,
80000-99999,90000,data_scientist,"R, Bioinformatics, SQL, Software Development, NoSQL, Python",6,649,4,30,MA,more than $10B ,"10,000+",Pharmaceuticals
80000-99999,90000,data_scientist,"Certified Internal Auditor, UI",2,502,4.300000191,30,DC,,"10,000+",Government
80000-99999,90000,data_scientist,"NoSQL, Project Management, Python, SQL",4,78,3.700000048,30,CO,,,Government
80000-99999,90000,data_scientist,"Data Mining, ""Drivers License"", SQL",3,33,3.5,30,NE,,"less than 10,000",Media and News and Publishing
80000-99999,90000,data_scientist,"Time Management, Machine Learning, Project Management, R, SAS, SQL, Python",7,126,4.199999809,30,TX,,,Education and Schools
80000-99999,90000,data_scientist,"XML, R, JSON, Git, REST, PostgreSQL, Data Analysis, Python",8,,,30,FL,,,
80000-99999,90000,data_scientist,"JavaScript, Google Analytics, Marketing, Python, SQL, Tableau",6,2,2.5,30,NY,,,
80000-99999,90000,data_scientist,"Linux, Perl, R, Bioinformatics, MySQL, Design Experience, Software Development, Cell Biology, Statistical Software, Oracle, Java, Python",12,2,4,30,MD,,,
80000-99999,90000,data_scientist,"Node.js, JavaScript, AI, Machine Learning, R, Python, SQL",7,,,26,IN,,,
80000-99999,90000,data_scientist,"JavaScript, R, SQL, Excel, Tableau, Java, MySQL, NoSQL, Python, DB2",10,23472,3.900000095,30,USA,,"10,000+",Consulting and Business Services
80000-99999,90000,data_scientist,"Project Management, R, SAS, Python, Tableau",5,5986,3.700000048,30,MN,more than $10B ,"10,000+",Banks and Financial Services
80000-99999,90000,data_scientist,"TensorFlow, Data Mining, Machine Learning",3,9,3.799999952,30,TX,,,
80000-99999,90000,data_scientist,"Linux, R, MySQL, Git, Immunoassays",5,,,30,MD,,,
80000-99999,90000,data_scientist,"Machine Learning, Image Processing",2,145,3.799999952,1,CA,$1B to $5B ,"10,000+",Internet and Software
80000-99999,90000,data_scientist,"Machine Learning, Visual Basic, R, Python",4,,,30,PA,,,
80000-99999,90000,data_scientist,"Machine Learning, Visual Basic, R, Python",4,,,30,PA,,,
80000-99999,90000,data_scientist,"Data Mining, Machine Learning, Military Experience, RMF",4,4966,3.700000048,30,PA,more than $10B ,"10,000+",Banks and Financial Services
80000-99999,90000,data_scientist,"Microsoft SQL Server, Data Mining, R, Oracle, SAS, SQL, Big Data, DB2",8,157456,3.599999905,30,AR,more than $10B ,"10,000+",Retail
80000-99999,90000,data_scientist,"Machine Learning, R, SQL, Analysis Skills, Python, Data Science",6,,,30,CA,,,
80000-99999,90000,data_scientist,"TensorFlow, Data Mining, Machine Learning",3,262,3.700000048,30,TX,$5B to $10B ,"less than 10,000",Energy and Utilities
80000-99999,90000,data_scientist,"Machine Learning, Hadoop, Azure, R, SQL, T-SQL, PL/SQL, Spark, Git, Software Development, Python, AWS",12,1129,4,19,MI,$5B to $10B ,"10,000+",Health Care
80000-99999,90000,data_scientist,"AI, Data Mining, Machine Learning, Six Sigma, Lean, Microsoft Office",6,6,3.700000048,30,WA,,,
80000-99999,90000,data_scientist,"Machine Learning, R, Python",3,18,4.099999905,1,NY,,"less than 10,000",Consulting and Business Services
80000-99999,90000,data_scientist,"AI, Machine Learning, R, Python",4,2078,4.199999809,4,MI,more than $10B ,"10,000+",Industrial Manufacturing
80000-99999,90000,data_scientist,"Machine Learning, Data Management, MATLAB, R, SAS",5,2433,3.799999952,30,PA,more than $10B ,"10,000+",Health Care
80000-99999,90000,data_scientist,"Microsoft Powerpoint, Visual Basic, R, Python, SQL, Microsoft Office, Tableau",7,3947,3.400000095,5,FL,$1B to $5B ,"10,000+",
80000-99999,90000,data_scientist,"Power BI, R, JSON, SQL, Tableau, Java, Natural Language Processing, MATLAB, OOP, Python",10,44,4,7,VA,,,
80000-99999,90000,data_scientist,"Data Mining, Machine Learning, R, Java, Natural Language Processing, Python",6,86,4.099999905,9,MD,,"less than 10,000",
80000-99999,90000,data_scientist,"Statistical Software, Data Analysis, R, SAS, Tableau",5,62,4.300000191,30,PA,,,Education and Schools
80000-99999,90000,data_scientist,"Microsoft Powerpoint, R, SAS, Microsoft Office, Excel, SQL, Managed Care",7,255,3.700000048,1,OH,,,
80000-99999,90000,data_scientist,Microsoft Office,1,23,3.599999905,30,TX,,"less than 10,000",Consulting and Business Services
80000-99999,90000,data_scientist,"Microsoft SQL Server, Data Mining, R, Oracle, SAS, SQL, Teradata",7,4479,3.299999952,30,CO,more than $10B ,"10,000+",Media and News and Publishing
80000-99999,90000,data_scientist,"Statistical Software, Business Intelligence, Data Mining, Analysis Skills, Data Analysis, SAS, Business Analysis, SQL",8,360,3.799999952,30,MO,less than $1B ,"less than 10,000",Banks and Financial Services
80000-99999,90000,data_scientist,"Java, MATLAB, Data Science, Python",4,6,4,30,CA,,,
80000-99999,90000,data_scientist,"Statistical Software, R, SAS, SQL, SPSS, Python",6,370,3.400000095,18,MN,,,
80000-99999,90000,data_scientist,Machine Learning,1,248,3.799999952,30,MN,$1B to $5B ,"10,000+",Energy and Utilities
80000-99999,90000,data_scientist,Microsoft Office,1,,,30,TX,,,
80000-99999,90000,data_scientist,"R, Statisical Analysis, SAS, Minitab, SPSS, Python",6,110,3.900000095,30,CO,,,
80000-99999,90000,data_scientist,"AI, Data Mining, Machine Learning",3,3348,3.799999952,30,USA,more than $10B ,"10,000+",Health Care
80000-99999,90000,data_scientist,"Hive, Data Mining, Machine Learning, Scripting, R, SQL, HBase, MongoDB, NoSQL, MATLAB",10,248,3.799999952,30,FL,$1B to $5B ,"10,000+",Energy and Utilities
80000-99999,90000,data_scientist,Machine Learning,1,31970,3.799999952,30,TX,more than $10B ,"10,000+",Telecommunications
80000-99999,90000,data_scientist,"Pig, Machine Learning, R, Perl, Sentiment Analytics, SQL, MySQL, SPSS, PostgreSQL, AI, Data Mining, Weka, Oracle, SAS, Minitab, Tableau, Spark, Python, Data Science",19,3094,3.299999952,11,NE,$1B to $5B ,"10,000+",Telecommunications
80000-99999,90000,data_scientist,"Statistical Software, Microsoft Powerpoint, R, SAS, STATA, Microsoft Word, SPSS",7,816,3.900000095,9,TX,,,Health Care
80000-99999,90000,data_scientist,AI,1,1568,4.199999809,10,MN,less than $1B ,"10,000+",Health Care
80000-99999,90000,data_scientist,"SAS, Excel, SQL, Microsoft Access",4,3532,3.599999905,30,GA,$5B to $10B ,"10,000+",Banks and Financial Services
80000-99999,90000,data_scientist,"Quantitative Analysis, Visual Basic, R, Oracle, C/C++, Excel, SQL, Tableau, ArcGIS, Troubleshooting, QlikView, Python, GIS",13,7197,4,5,VA,,"10,000+",Consulting and Business Services
80000-99999,90000,data_scientist,"AI, Machine Learning, R, SQL, Data Analysis, Python",6,1086,4.099999905,30,CA,more than $10B ,"10,000+",Health Care
80000-99999,90000,data_scientist,"Hive, Data Mining, Ruby, Machine Learning, Hadoop, R, Statisical Analysis, C/C++, Java, Spark, MATLAB, Python, PHP",13,112,3,30,VA,,,
80000-99999,90000,data_scientist,"Machine Learning, R, MATLAB",3,36,4.099999905,29,MA,,,
80000-99999,90000,data_scientist,"TensorFlow, Machine Learning, R, MATLAB, Data Science, Python, C/C++",7,3826,4.099999905,30,CA,more than $10B ,"10,000+",Computers and Electronics
80000-99999,90000,data_scientist,"Data Mining, Microsoft SQL Server, Machine Learning, R, SAS, SQL, Tableau, ACH, Six Sigma, Python, DB2",11,2153,3.700000048,9,NC,less than $1B ,"10,000+",Banks and Financial Services
80000-99999,90000,data_scientist,"TensorFlow, Hive, Machine Learning, R, Azure, Google Cloud Platform, Statisical Analysis, C/C++, SQL, MySQL, S3, JavaScript, Data Mining, Hadoop, Scripting, Java, Spark, Python, Data Science",19,573,3.900000095,30,CO,,,Health Care
80000-99999,90000,data_scientist,"Machine Learning, C/C++, SQL, Troubleshooting, NoSQL, Python",6,1652,4,30,WI,,,Industrial Manufacturing
80000-99999,90000,data_scientist,"Machine Learning, Data Management, Network, R, C/C++, JSON, SQL, Haskell, Java, CI, Unit Testing, NoSQL, MATLAB, Python, OOP",15,,,26,USA,,,
80000-99999,90000,data_scientist,"Data Mining, Machine Learning, R, Statisical Analysis, Java, Natural Language Processing, MATLAB, Python",8,86,4.099999905,9,MD,,"less than 10,000",
80000-99999,90000,data_scientist,"Linux, System Design, Survival Analysis, Machine Learning, R, SQL, Java, MATLAB, Python",9,4615,3.900000095,30,CA,,"10,000+",Health Care
80000-99999,90000,data_scientist,"Database Administration, Microsoft SQL Server, R, PostgreSQL, MATLAB, OOP, PHP, Drupal, Software Testing, SAS, Microsoft Office, Content Management Systems, ArcGIS, Troubleshooting, WordPress",15,428,4.300000191,20,NM,,,Education and Schools
80000-99999,90000,data_scientist,"TensorFlow, Linux, Machine Learning, C/C++, Python, Jira",6,81,3.200000048,18,GA,less than $1B ,"less than 10,000",Consulting and Business Services
80000-99999,90000,data_scientist,"Data Mining, SAS, Excel, SQL, Microsoft Access",5,3532,3.599999905,30,GA,$5B to $10B ,"10,000+",Banks and Financial Services
80000-99999,90000,data_scientist,"Java, Machine Learning, Python",3,2174,4,1,TX,more than $10B ,"10,000+",Insurance
80000-99999,90000,data_scientist,"Big Data, SAS",2,14987,4,14,TX,more than $10B ,"10,000+",Consulting and Business Services
80000-99999,90000,data_scientist,"TensorFlow, Microsoft Project, Data Mining, Machine Learning, Hadoop, R, Scala, SAS, SQL, Excel, Tableau, Big Data, Natural Language Processing, Spark, SPSS, Visio, Python",17,1008,3.5,30,FL,more than $10B ,"less than 10,000",Health Care
80000-99999,90000,data_scientist,"Data Mining, Project Management, R, SAS, SQL, Teradata, Tableau, Python",8,1764,3.799999952,30,AZ,,"10,000+",Health Care
80000-99999,90000,data_scientist,"PL/SQL, Data Mining, Machine Learning, R, Weka, MATLAB, Oracle, Python",8,504,3.799999952,30,MI,,"10,000+",Auto
80000-99999,90000,data_scientist,"Machine Learning, SPSS, R, SAS, Python, Tableau",6,692,3.700000048,30,AZ,less than $1B ,"10,000+",Consulting and Business Services
80000-99999,90000,data_scientist,"Project Management, R, SAP, SAS, SQL, Tableau, SPSS, QlikView, MATLAB",9,302,3.799999952,28,OH,$1B to $5B ,"less than 10,000",Industrial Manufacturing
80000-99999,90000,data_scientist,,0,23,3.599999905,30,VA,,"less than 10,000",Consulting and Business Services
