Salary1,Salary2,Job_Type,Skill,No_of_Skills,No_of_Reviews,No_of_Stars,Date_Since_Posted,Location,Revenue,Employees,Industry
less than80000,80000,data_analyst,"Cerner, Time Management, Microsoft Powerpoint, XML, Power BI, JSON, Microsoft Office",7,45,3.200000048,2,TX,,"less than 10,000",Health Care
less than80000,80000,data_analyst,,0,541,4.199999809,1,PA,,,Education and Schools
less than80000,80000,data_analyst,"Data Warehouse, Data Analysis, SQL, Microsoft Access",4,1134,3.299999952,19,CA,$5B to $10B ,"less than 10,000",InsuranceHealth Care
less than80000,80000,data_analyst,"Alteryx, SQL, Excel",3,2722,3.599999905,30,MA,more than $10B ,"10,000+",Health Care
less than80000,80000,data_analyst,"Microsoft Powerpoint, R, SAS, SQL, Microsoft Office, Tableau",6,2080,3.799999952,8,OH,more than $10B ,"10,000+",Insurance
less than80000,80000,data_analyst,"SAS, SQL, Tableau, STATA, Data Analysis",5,,,15,CA,,,
less than80000,80000,data_analyst,,0,830,4.099999905,30,NY,,,Education and Schools
less than80000,80000,data_analyst,"Data Analysis, SAS, Excel, SQL, Microsoft Office",5,,,19,MO,,,
less than80000,80000,data_analyst,"Salesforce CRM, Google Analytics",2,,,30,MA,,,
less than80000,80000,data_analyst,"Quantitative Analysis, Microsoft Powerpoint, SAS, SQL",4,,,15,PA,,,
less than80000,80000,data_analyst,"S3, Python, SQL, JSON, AWS",5,,,23,CA,,,
less than80000,80000,data_analyst,"Statisical Analysis, SQL, Tableau",3,45,4,30,MN,,,
less than80000,80000,data_analyst,,0,282,4.199999809,26,CA,,,Education and Schools
less than80000,80000,data_analyst,,0,,,2,MI,,,
less than80000,80000,data_analyst,"Data Mining, SQL, Tableau",3,20,2.599999905,14,MO,,,
less than80000,80000,data_analyst,"Analysis Skills, Machine Learning, R, Python, Tableau",5,6415,4.099999905,30,TX,more than $10B ,"10,000+",Aerospace and Defense
less than80000,80000,data_analyst,"SharePoint, Regulatory Reporting, Microsoft Office",3,2904,4.099999905,2,MN,more than $10B ,"10,000+",Banks and Financial Services
less than80000,80000,data_analyst,"Salesforce CRM, R, Tableau",3,,,29,CA,less than $1B ,"less than 10,000",Organization
less than80000,80000,data_analyst,"Quality Management, Microsoft Office",2,431,4,10,MA,$5B to $10B ,"10,000+",Construction
less than80000,80000,data_analyst,"Microsoft Powerpoint, Hadoop, Power BI, R, SAS, SQL, Tableau, Alteryx, Python",9,5986,3.700000048,30,MN,more than $10B ,"10,000+",Banks and Financial Services
less than80000,80000,data_analyst,"Statisical Analysis, Excel, Microsoft Office",3,,,15,DC,,,
less than80000,80000,data_analyst,"Machine Learning, SQL, Python",3,2,3,1,MD,$5B to $10B ,"10,000+",Restaurants and Travel and Leisure
less than80000,80000,data_analyst,"Data Mining, Python, SQL",3,530,4.300000191,29,CA,,"less than 10,000",Education and Schools
less than80000,80000,data_analyst,"SAS, Oracle, SQL, Tableau",4,99,3.700000048,30,TX,,,Health Care
less than80000,80000,data_analyst,"Time Management, Excel, SQL, Tableau",4,21,3.400000095,22,CA,,,
less than80000,80000,data_analyst,"JavaScript, R, SQL, HTML5, Tableau, Confluence, CSS, Python, Jira",9,717,4.199999809,30,MA,,,Computers and Electronics
less than80000,80000,data_analyst,"Data Mining, Statisical Analysis",2,96,3.200000048,21,TN,,"less than 10,000",
less than80000,80000,data_analyst,"SAS, Microsoft Office, SQL",3,2080,3.799999952,4,OH,more than $10B ,"10,000+",Insurance
less than80000,80000,data_analyst,"Excel, Customer Service, Microsoft Access",3,41290,3.799999952,5,GA,more than $10B ,"10,000+",RetailConsumer Goods and Services
less than80000,80000,data_analyst,"Data Analysis, SQL, Microsoft Access",3,1134,3.299999952,21,MO,$5B to $10B ,"less than 10,000",InsuranceHealth Care
less than80000,80000,data_analyst,"Data Analysis, SQL, Microsoft Access",3,1134,3.299999952,22,MO,$5B to $10B ,"less than 10,000",InsuranceHealth Care
less than80000,80000,data_analyst,"SQL, Data Analysis",2,44,4.5,30,CA,,"less than 10,000",Media and News and Publishing
less than80000,80000,data_analyst,,0,7,4.099999905,4,WA,,,
less than80000,80000,data_analyst,"Microsoft Powerpoint, Microsoft Office",2,118,3.299999952,28,NV,,"less than 10,000",Health Care
less than80000,80000,data_analyst,,0,1887,3.799999952,7,CA,,"10,000+",Real Estate
less than80000,80000,data_analyst,,0,8164,4.199999809,8,CA,,"10,000+",Health Care
less than80000,80000,data_analyst,,0,1642,3.299999952,4,WA,,,Internet and Software
less than80000,80000,data_analyst,"R, SAS, Statisical Analysis, SQL, Microsoft Office, Microsoft Access, STATA",7,,,30,TX,,,
less than80000,80000,data_analyst,"Data Mining, SQL, Microsoft Office, Tableau, Data Analysis",5,3,2,30,MN,,,Insurance
less than80000,80000,data_analyst,Tableau,1,2094,4.400000095,30,MN,,,Government
less than80000,80000,data_analyst,"Excel, SQL",2,17,4,30,CT,,,Health Care
less than80000,80000,data_analyst,Microsoft Office,1,133,3.900000095,30,NY,,,Organization
less than80000,80000,data_analyst,,0,18,4.199999809,19,WA,,"less than 10,000",Health Care
less than80000,80000,data_analyst,"Epic, Medical Terminology, Data Analysis",3,62,4.099999905,8,KS,less than $1B ,"less than 10,000",Health Care
less than80000,80000,data_analyst,"Microsoft SQL Server, Excel, SQL",3,732,4.400000095,30,PA,,"less than 10,000",Education and Schools
less than80000,80000,data_analyst,"SAS, SQL, Microsoft Access",3,56,3.400000095,30,NY,,,Health Care
less than80000,80000,data_analyst,"SharePoint, Visual Studio, Microsoft SQL Server, Time Management, SQL, Microsoft Office",6,1666,3.5,7,NY,,,Banks and Financial Services
less than80000,80000,data_analyst,"Statistical Software, Microsoft Powerpoint, R, SAS, Microsoft Office, Tableau, SPSS",7,5,3.400000095,2,PA,,,
less than80000,80000,data_analyst,"Microsoft Office, Excel",2,1113,3.700000048,1,OH,,"10,000+",Consumer Goods and Services
less than80000,80000,data_analyst,"Data Analysis, R, Python",3,,,29,CO,,,
less than80000,80000,data_analyst,"JavaScript, Data Mining, XML, SAS, SQL, SPSS",6,722,4.199999809,4,PA,,"10,000+",Education and Schools
less than80000,80000,data_analyst,"Microsoft Powerpoint, Visio, Data Analysis, Microsoft Office",4,3,1.700000048,8,MD,,,
less than80000,80000,data_analyst,"Data Mining, Microsoft Powerpoint, Google Analytics, R, SAS, SQL, Tableau, STATA",8,10,3.099999905,30,TX,,,Internet and Software
less than80000,80000,data_analyst,"Power BI, R, SQL, Microsoft Access, SPSS",5,30,3.700000048,30,CO,,,
less than80000,80000,data_analyst,,0,,,,,,,
less than80000,80000,data_analyst,"Microsoft Powerpoint, Marketing, SAS, SQL, Microsoft Office, Tableau, Multichannel Marketing",7,34,3.599999905,30,MA,,,
less than80000,80000,data_analyst,"MongoDB, Quantitative Analysis, Analysis Skills, Google Analytics, PostgreSQL, Data Analysis, Magento",7,484,4.300000191,16,TX,$5B to $10B ,"10,000+",Internet and Software
less than80000,80000,data_analyst,Microsoft Office,1,2015,4.099999905,11,PA,more than $10B ,"10,000+",Auto
less than80000,80000,data_analyst,Microsoft Office,1,2015,4.099999905,11,PA,more than $10B ,"10,000+",Auto
less than80000,80000,data_analyst,"Microsoft SQL Server, Data Mining, Microsoft Powerpoint, R, Oracle, SAS, SQL, Excel, Sybase, Microsoft Access, STATA, SPSS",12,72,3.200000048,5,OR,,,Banks and Financial Services
less than80000,80000,data_analyst,"SAS, SQL, Microsoft Office, Excel, Microsoft Access",5,9,3.900000095,30,NV,,,
less than80000,80000,data_analyst,"Data Warehouse, SQL",2,1169,3.799999952,30,OH,less than $1B ,"less than 10,000",Auto
less than80000,80000,data_analyst,"Python, SQL, AWS",3,,,30,TX,,,
less than80000,80000,data_analyst,"JavaScript, Confluence, Time Management, Software Development, Visual Basic, Jira, Aviation Experience",7,2,3.5,8,TX,,,
less than80000,80000,data_analyst,"Power BI, SAS, Tableau, Predictive Analytics, SPSS, Data Analysis",6,,,21,GA,,,
less than80000,80000,data_analyst,"Accounting, ERP Systems, Microsoft Powerpoint, SAP, Microsoft Office",5,237,3.700000048,30,NJ,,,
less than80000,80000,data_analyst,"Data Mining, Visual Basic, SQL, Microsoft Access",4,56,3.900000095,15,MO,,"less than 10,000",Insurance
less than80000,80000,data_analyst,"Data Mining, Microsoft Powerpoint, SPSS, SAS, SQL, Tableau",6,16,2.900000095,30,TX,,"less than 10,000",Consulting and Business Services
less than80000,80000,data_analyst,"Microsoft Powerpoint, Python, SQL, Excel",4,7,3.599999905,30,NJ,,"less than 10,000",Consulting and Business Services
less than80000,80000,data_analyst,"R, Statisical Analysis, SAS",3,580,4.099999905,30,GA,,,Education and Schools
less than80000,80000,data_analyst,"Microsoft Powerpoint, Excel, SQL, HTML5",4,,,30,CA,,,
less than80000,80000,data_analyst,,0,43,2.5,11,TX,,"less than 10,000",Consulting and Business Services
less than80000,80000,data_analyst,"Microsoft Powerpoint, SQL, Microsoft Office",3,575,3.900000095,5,MA,,,
less than80000,80000,data_analyst,"Data Mining, Time Management, Microsoft Powerpoint, Hadoop, R, Statisical Analysis, SAS, SQL, Microsoft Office, Big Data, Python",11,259,3.400000095,30,USA,,,
less than80000,80000,data_analyst,"SAS, SQL, Microsoft Office, Excel, Microsoft Access",5,9,3.900000095,30,NV,,,
less than80000,80000,data_analyst,Data Mining,1,735,3.799999952,29,NC,less than $1B ,"less than 10,000",Insurance
less than80000,80000,data_analyst,"SQL, Tableau, Microsoft Access, Analysis Skills",4,79,2.900000095,30,WA,,"less than 10,000",Health Care
less than80000,80000,data_analyst,"JavaScript, Data Analysis, CSS, Excel, HTML5, SQL",6,84,3.599999905,4,VA,,"less than 10,000",Health Care
less than80000,80000,data_analyst,"Salesforce CRM, Data Analysis",2,309,3.799999952,26,AZ,,"less than 10,000",Health Care
less than80000,80000,data_analyst,Microsoft Office,1,17,2.700000048,13,PA,less than $1B ,"less than 10,000",Energy and Utilities
less than80000,80000,data_analyst,,0,,,30,CA,,,
less than80000,80000,data_analyst,"SQL, Tableau",2,4,4,30,CA,,,
less than80000,80000,data_analyst,Excel,1,85,3.5,30,MD,less than $1B ,"less than 10,000",Consumer Goods and Services
less than80000,80000,data_analyst,,0,8164,4.199999809,30,CA,,"10,000+",Health Care
less than80000,80000,data_analyst,"Microsoft Powerpoint, Microsoft Office, Tableau",3,18,3.299999952,5,NJ,,,
less than80000,80000,data_analyst,"Data Warehouse, R, SAS, Python, SQL, Excel",6,91,2.599999905,30,NY,,"less than 10,000",Education and Schools
less than80000,80000,data_analyst,"Microsoft Powerpoint, Power BI, Excel",3,3476,3.400000095,1,TX,,,
less than80000,80000,data_analyst,"Quantitative Analysis, Data Mining, R, SQL, MATLAB, Python",6,5,3.799999952,30,CA,,,
less than80000,80000,data_analyst,"ICD-10, SQL, Microsoft Office",3,4,4.300000191,13,NY,,,
less than80000,80000,data_analyst,"Data Warehouse, Data Analysis, SQL, Microsoft Access",4,1134,3.299999952,23,CA,$5B to $10B ,"less than 10,000",InsuranceHealth Care
less than80000,80000,data_analyst,,0,,,,,,,
less than80000,80000,data_analyst,SQL,1,260,3.400000095,11,CT,more than $10B ,"less than 10,000",Banks and Financial Services
less than80000,80000,data_analyst,"Data Mining, Microsoft Powerpoint, SPSS, SAS, SQL, Tableau",6,16,2.900000095,30,TX,,"less than 10,000",Consulting and Business Services
less than80000,80000,data_analyst,"Data Analysis, SQL, Microsoft Access",3,,,28,FL,$5B to $10B ,"less than 10,000",InsuranceHealth Care
less than80000,80000,data_analyst,"Microsoft Powerpoint, Conversion Optimization, Marketing, Excel, Microsoft Office",5,,,14,CA,,,
less than80000,80000,data_analyst,"Microsoft Powerpoint, R, SAS, SQL",4,259,3.400000095,15,GA,,,
less than80000,80000,data_analyst,"Microsoft Powerpoint, Microsoft Office",2,41,3.5,30,CO,,,Banks and Financial Services
less than80000,80000,data_analyst,Excel,1,899,3.799999952,15,OH,more than $10B ,"10,000+",Consumer Goods and Services
less than80000,80000,data_analyst,"Integrated Library System, Time Management, SQL",3,2,5,7,MD,,,
less than80000,80000,data_analyst,"Microsoft Powerpoint, SPSS, Visual Basic, Python, Excel, SQL",6,,,30,IL,,,
less than80000,80000,data_analyst,"Microsoft SQL Server, Time Management, Scripting, Microsoft Office, SQL, Microsoft Access, Data Analysis, Shell Scripting",8,108,3.299999952,14,NY,,,
less than80000,80000,data_analyst,"Microsoft SQL Server, SQL, Microsoft Access, REST",4,14,3.099999905,28,MA,,,
less than80000,80000,data_analyst,"Pig, Hive, Machine Learning, R, SQL, SPSS, MATLAB, Data Mining, SAS, Python",10,,,30,NC,,,
less than80000,80000,data_analyst,Data Mining,1,732,4.400000095,30,PA,,"less than 10,000",Education and Schools
less than80000,80000,data_analyst,"Microsoft SQL Server, XML, Oracle, SQL, Microsoft Word",5,250,3.200000048,7,MD,less than $1B ,"less than 10,000",Health Care
less than80000,80000,data_analyst,"Salesforce CRM, Data Mining, Data Warehouse, Microsoft Powerpoint, Microsoft Office",5,72,3.799999952,30,TX,,"less than 10,000",Insurance
less than80000,80000,data_analyst,"Excel, Microsoft Office, Tableau",3,113,3.299999952,5,CA,,"less than 10,000",Consulting and Business Services
less than80000,80000,data_analyst,"SAS, SQL",2,3205,3.599999905,11,TX,,"10,000+",Health Care
less than80000,80000,data_analyst,"Microsoft Powerpoint, SQL, Windows, Managed Care",4,90,3.700000048,11,KY,,"less than 10,000",Health Care
less than80000,80000,data_analyst,"JavaScript, Microsoft Powerpoint, SQL, HTML5, Excel, Python",6,2,3,29,USA,,,
less than80000,80000,data_analyst,"Microsoft Word, Time Management, Microsoft Powerpoint, SPSS, R, SAS, SQL",7,42,3.400000095,30,HI,,"less than 10,000",Health Care
less than80000,80000,data_analyst,"R, SAS, SQL, Tableau",4,265,4.5,30,TN,,"less than 10,000",Health Care
less than80000,80000,data_analyst,"Excel, Microsoft Office, Microsoft Access",3,,,30,CA,,,
less than80000,80000,data_analyst,"Microsoft Powerpoint, SPSS, Visual Basic, Python, Excel, SQL",6,,,30,MN,,,
less than80000,80000,data_analyst,"Statistical Software, Microsoft Powerpoint, Microsoft Office",3,21,3.700000048,30,OH,,,
less than80000,80000,data_analyst,"Data Mining, Microsoft Powerpoint, Power BI, Statisical Analysis, Microsoft Office, Tableau",6,930,4.199999809,11,MN,,,Education and Schools
less than80000,80000,data_analyst,"Data Mining, R, SQL, Python",4,,,30,NY,,,Government
less than80000,80000,data_analyst,"ERP Systems, Oracle, SQL, Excel, Microsoft Office, Microsoft Access, Analysis Skills",7,16,3.799999952,8,CA,,,
less than80000,80000,data_analyst,"Bilingual, Microsoft Powerpoint, R, SAS, SQL, Microsoft Office, Java, STATA, Python",9,,,28,CA,,,
less than80000,80000,data_analyst,,0,,,30,TN,,,
less than80000,80000,data_analyst,"Time Management, Microsoft Powerpoint, Microsoft Office",3,,,22,TX,,,
less than80000,80000,data_analyst,"Microsoft Powerpoint, Excel",2,7,3.599999905,30,PA,,"less than 10,000",Consulting and Business Services
less than80000,80000,data_analyst,"Microsoft SQL Server, Data Warehouse, Crystal Reports, SQL",4,9,3,30,VA,,,
less than80000,80000,data_analyst,"Visual Basic, Microsoft Office, SQL, HTML5, Microsoft Access",5,2664,4.199999809,30,GA,$1B to $5B ,"less than 10,000",Insurance
less than80000,80000,data_analyst,"SAS, Managed Care, Microsoft Access",3,517,3.599999905,30,NY,,"less than 10,000",Insurance
less than80000,80000,data_analyst,"Data Warehouse, Data Analysis, Audits, SQL, Microsoft Access",5,1134,3.299999952,21,MO,$5B to $10B ,"less than 10,000",InsuranceHealth Care
less than80000,80000,data_analyst,"Business Intelligence, Microsoft SQL Server, QlikView, Business Analysis, SQL, Tableau",6,25,4.099999905,25,FL,less than $1B ,"less than 10,000",Health Care
less than80000,80000,data_analyst,"SharePoint, Visual Studio, Microsoft SQL Server, Time Management, SQL, Microsoft Office",6,1666,3.5,6,NY,,,Banks and Financial Services
less than80000,80000,data_analyst,"HTML5, CPT Coding, SQL, Microsoft Access, ICD-9",5,331,3.900000095,30,MA,,,Health Care
less than80000,80000,data_analyst,Data Mining,1,,,30,NY,,,
less than80000,80000,data_analyst,"Microsoft SQL Server, Microsoft Powerpoint, Crystal Reports, Excel, SQL, Tableau, Microsoft Access",7,87,3.900000095,6,MA,,,Health Care
less than80000,80000,data_analyst,"Analysis Skills, Oracle, Quantitative Research, Excel",4,9,4,1,MA,,,
less than80000,80000,data_analyst,"Power BI, R, SAS, SQL, Excel, Tableau",6,3476,3.400000095,24,NC,,,
less than80000,80000,data_analyst,"Data Mining, Data Analysis",2,530,4.300000191,18,CA,,"less than 10,000",Education and Schools
less than80000,80000,data_analyst,"Microsoft SQL Server, Oracle, Crystal Reports, SQL, Tableau",5,689,4.199999809,30,MA,,,Education and Schools
less than80000,80000,data_analyst,,0,5,5,26,GA,,,
less than80000,80000,data_analyst,"JavaScript, Data Analysis, SQL",3,2641,4.300000191,30,CA,more than $10B ,"10,000+",Internet and Software
less than80000,80000,data_analyst,"Microsoft Powerpoint, Microsoft Access",2,1666,3.5,6,WI,,,Banks and Financial Services
less than80000,80000,data_analyst,"Statistical Software, Microsoft Powerpoint, Microsoft Office",3,127,3.799999952,30,OH,less than $1B ,"less than 10,000",Health Care
less than80000,80000,data_analyst,Data Mining,1,,,30,TX,,,
less than80000,80000,data_analyst,"Design Patterns, Data Analysis, SQL",3,,,26,MI,,,
less than80000,80000,data_analyst,,0,377,4.199999809,6,MA,,"less than 10,000",Organization
less than80000,80000,data_analyst,Time Management,1,14,4.099999905,30,NY,,,
less than80000,80000,data_analyst,"ArcGIS, Microsoft Word, Data Analysis, GIS, Microsoft Office, Excel, Microsoft Access, Windows",8,944,4,30,CO,,,Agriculture and Extraction
less than80000,80000,data_analyst,"Microsoft SQL Server, Scripting, Marketing, Oracle, SQL, Teradata, Email Marketing, Data Warehouse, Informatica, Shell Scripting",10,16,3,5,TX,,,
less than80000,80000,data_analyst,"Microsoft SQL Server, Scripting, Marketing, Oracle, SQL, Teradata, Email Marketing, Data Warehouse, Informatica, Shell Scripting",10,16,3,6,TX,,,
less than80000,80000,data_analyst,"Microsoft Powerpoint, Crystal Reports",2,364,4,5,IL,,,Health Care
less than80000,80000,data_analyst,Business Analysis,1,505,3.599999905,28,PA,,,Health Care
less than80000,80000,data_analyst,"JavaScript, Data Mining, XML, SAS, SQL, SPSS",6,,,30,MD,,,
less than80000,80000,data_analyst,"Data Mining, Microsoft SQL Server, Crystal Reports, SQL, Microsoft Office",5,187,3.700000048,30,NY,,,Health Care
less than80000,80000,data_analyst,"Data Analysis, Excel",2,67,2.900000095,27,NY,,"less than 10,000",Energy and Utilities
less than80000,80000,data_analyst,"Data Mining, Time Management, Microsoft Powerpoint, Hadoop, R, Statisical Analysis, SAS, SQL, Microsoft Office, Big Data, Python",11,988,3.799999952,30,GA,$1B to $5B ,"less than 10,000",Banks and Financial Services
less than80000,80000,data_analyst,,0,1435,3.900000095,30,DC,$1B to $5B ,"10,000+",Consulting and Business Services
less than80000,80000,data_analyst,"Data Mining, Microsoft Powerpoint, Microsoft Office",3,155,3.799999952,30,NY,,,
less than80000,80000,data_analyst,"Data Analysis, SQL, Microsoft Access",3,1134,3.299999952,29,MO,$5B to $10B ,"less than 10,000",InsuranceHealth Care
less than80000,80000,data_analyst,"Power BI, Marketing, SQL, Microsoft Office, Tableau",5,,,13,MI,,,
less than80000,80000,data_analyst,"Microsoft SQL Server, Excel, SQL",3,732,4.400000095,30,PA,,"less than 10,000",Education and Schools
less than80000,80000,data_analyst,"Microsoft Office, SharePoint, Leadership Experience",3,32,3.599999905,20,MA,$1B to $5B ,"less than 10,000",
less than80000,80000,data_analyst,,0,,,22,VA,,,
less than80000,80000,data_analyst,"Microsoft Powerpoint, SQL",2,13,3.200000048,30,CA,,,
less than80000,80000,data_analyst,"Microsoft Powerpoint, Microsoft Access",2,1666,3.5,6,WI,,,Banks and Financial Services
less than80000,80000,data_analyst,"R, Python, SQL, Tableau",4,16,2.299999952,27,OH,,,
less than80000,80000,data_analyst,"Business Intelligence, SQL",2,2380,3.599999905,30,TN,$5B to $10B ,"10,000+",Retail
less than80000,80000,data_analyst,"Microsoft Powerpoint, Microsoft Word, Visio",3,12,3.299999952,30,DC,,"less than 10,000",Consulting and Business Services
less than80000,80000,data_analyst,Excel,1,14,4.599999905,30,MA,,,
less than80000,80000,data_analyst,"Excel, SQL, Microsoft Access, Data Analysis",4,1472,3.900000095,30,IL,,,Health Care
less than80000,80000,data_analyst,"Data Analysis, Excel, SQL, Microsoft Office, Microsoft Access",5,1134,3.299999952,19,IA,$5B to $10B ,"less than 10,000",InsuranceHealth Care
less than80000,80000,data_analyst,"Java, Analysis Skills, Python, C/C++, SQL, Excel",6,,,7,WA,,,
less than80000,80000,data_analyst,"Performance Marketing, Customer Segmentation, Excel, SPSS, Multichannel Marketing, Microsoft Powerpoint, Marketing, Microsoft Office, Tableau",9,31,4.199999809,6,CA,,,Transport and Freight
less than80000,80000,data_analyst,"Business Intelligence, Microsoft Powerpoint, Marketing Automation, Marketing, Omniture, SQL, Tableau, Marketo, Visio, Doubleclick, Multichannel Marketing",11,12,3.5,12,NY,,,
less than80000,80000,data_analyst,"Data Warehouse, Data Analysis, SQL, Microsoft Access",4,1134,3.299999952,30,CA,$5B to $10B ,"less than 10,000",InsuranceHealth Care
less than80000,80000,data_analyst,"Database Marketing, Marketing Automation, SQL, Microsoft Office, Tableau",5,,,14,WA,,,
less than80000,80000,data_analyst,"Microsoft Powerpoint, Python, SQL, Excel",4,7,3.599999905,30,PA,,"less than 10,000",Consulting and Business Services
less than80000,80000,data_analyst,,0,1642,3.299999952,30,NV,,,Internet and Software
less than80000,80000,data_analyst,"Analysis Skills, Microsoft Office",2,201,3.400000095,12,NJ,,"10,000+",
less than80000,80000,data_analyst,"Data Analysis, R, SAS",3,4573,3.799999952,30,AR,more than $10B ,"10,000+",Aerospace and Defense
less than80000,80000,data_analyst,"Microsoft Powerpoint, Data Analysis, Excel",3,1907,4.300000191,30,CA,,,
less than80000,80000,data_analyst,"Microsoft SQL Server, Microsoft Powerpoint, Crystal Reports, Excel, SQL, Tableau, Microsoft Access",7,87,3.900000095,5,MA,,,Health Care
less than80000,80000,data_analyst,"Data Mining, Microsoft Powerpoint, Project Management, Microsoft Office, SQL, Excel",6,32,3.200000048,18,CA,,,Health Care
less than80000,80000,data_analyst,"Java, Microsoft SQL Server, Microsoft Powerpoint, Visual Basic, SAS, Python, SQL, Microsoft Office, HTML5",9,7,2.599999905,30,NY,,,Banks and Financial Services
less than80000,80000,data_analyst,"Visual Basic, Microsoft Office, SQL",3,2309,3.900000095,30,IL,more than $10B ,"10,000+",Banks and Financial Services
less than80000,80000,data_analyst,"T-SQL, Microsoft SQL Server, QlikView, Oracle, SQL, Tableau",6,134,3.900000095,8,AR,,,
less than80000,80000,data_analyst,"Java, STATA, R",3,57,4.199999809,29,IN,,,
less than80000,80000,data_analyst,"Marketing Automation, Marketing, Digital Marketing, Microsoft Office",4,8,3.599999905,6,WA,,"less than 10,000",Consulting and Business Services
less than80000,80000,data_analyst,"Marketing Automation, Marketing, Digital Marketing, Microsoft Office",4,8,3.599999905,6,WA,,"less than 10,000",Consulting and Business Services
less than80000,80000,data_analyst,"Project Management, Excel",2,,,30,FL,,,
less than80000,80000,data_analyst,"JavaScript, R, SQL, HTML5, Tableau, CSS",6,150,3.799999952,5,VA,,,Government
less than80000,80000,data_analyst,"Business Intelligence, Data Mining, R, SAS, Oracle, SQL, Tableau, Microsoft Access, Alteryx, Data Warehouse, SPSS, Python",12,237,3.900000095,30,OH,,"less than 10,000",Education and Schools
less than80000,80000,data_analyst,"Project Management, Excel",2,97,4,30,CA,$1B to $5B ,"less than 10,000",Industrial Manufacturing
less than80000,80000,data_analyst,"Quantitative Analysis, Microsoft Powerpoint, SAS, SQL",4,9,3.900000095,30,DC,,,
less than80000,80000,data_analyst,"SQL, Data Analysis",2,77,3.599999905,30,SC,less than $1B ,"less than 10,000",Internet and Software
less than80000,80000,data_analyst,"Salesforce CRM, Python, SQL, Tableau",4,22,3.799999952,25,CA,,"less than 10,000",Computers and Electronics
less than80000,80000,data_analyst,,0,318,3.5,30,MD,,,
less than80000,80000,data_analyst,"PeopleSoft, Microsoft Powerpoint, OBIEE, SAS, Oracle, Excel, SQL, Tableau, PL/SQL, Design Experience, Data Analysis",11,454,4.300000191,18,TX,,,Education and Schools
less than80000,80000,data_analyst,"Molecular Biology, Linux, C/C++, Java, Software Development, Data Analysis, Shell Scripting, OOP, Python",9,430,4.199999809,27,UT,,"10,000+",Education and Schools
less than80000,80000,data_analyst,"Microsoft Powerpoint, Oracle, Microsoft Office",3,104,3.099999905,30,NJ,,"less than 10,000",Computers and Electronics
less than80000,80000,data_analyst,"Microsoft Powerpoint, Oracle, Microsoft Office",3,104,3.099999905,30,NJ,,"less than 10,000",Computers and Electronics
less than80000,80000,data_analyst,,0,8164,4.199999809,26,CA,,"10,000+",Health Care
less than80000,80000,data_analyst,,0,1435,3.900000095,30,DC,$1B to $5B ,"10,000+",Consulting and Business Services
less than80000,80000,data_analyst,Salesforce CRM,1,758,4.199999809,30,CO,,,Education and Schools
less than80000,80000,data_analyst,"Microsoft Powerpoint, Microsoft Office",2,,,12,IL,,,
less than80000,80000,data_analyst,SAS,1,17,3.599999905,19,MD,less than $1B ,"less than 10,000",Consulting and Business Services
less than80000,80000,data_analyst,"STATA, Data Mining, R, SAS, SQL, Tableau",6,430,4.199999809,30,UT,,"10,000+",Education and Schools
less than80000,80000,data_analyst,"SAS, SQL",2,14987,4,14,TX,more than $10B ,"10,000+",Consulting and Business Services
less than80000,80000,data_analyst,"R, SAS, Statisical Analysis, SQL, Tableau, SPSS",6,131,3.400000095,9,MD,less than $1B ,"less than 10,000",Aerospace and Defense
less than80000,80000,data_analyst,"JD Edwards, Microsoft SQL Server, Data Warehouse, Visio, Data Analysis",5,174,3.299999952,16,WA,,,
less than80000,80000,data_analyst,"Microsoft Word, Microsoft Powerpoint, Excel, Microsoft Access",4,336,3.099999905,30,IL,,"less than 10,000",Health Care
