Salary1,Salary2,Job_Type,Skill,No_of_Skills,No_of_Reviews,No_of_Stars,Date_Since_Posted,Location,Revenue,Employees,Industry
120000-139999,130000,data_scientist,"Pig, Hive, Machine Learning, Experimental Design, Perl, R, C/C++, Solr, Natural Language Processing, Data Analysis, MATLAB, AI, Data Mining, Hadoop, Scala, HBase, Java, Lucene, Spark, NoSQL",20,32,3.599999905,30,NY,,,Banks and Financial Services
120000-139999,130000,data_scientist,"Data Mining, Microsoft SQL Server, Machine Learning, Power BI, Crystal Reports, C/C++, Tableau, Java, Natural Language Processing, Python",10,,,10,NJ,,,
120000-139999,130000,data_scientist,"Data Mining, Microsoft SQL Server, Machine Learning, Power BI, Crystal Reports, C/C++, Tableau, Java, Natural Language Processing, Python",10,,,10,NJ,,,
120000-139999,130000,data_scientist,"Cassandra, Spark, Machine Learning, Python, SQL, Elasticsearch",6,,,30,MA,,,
120000-139999,130000,data_scientist,"TensorFlow, Machine Learning, TS/SCI Clearance, Hadoop, R, Tableau, Splunk, Natural Language Processing, MongoDB, Docker, Python, Elasticsearch",12,1733,3.900000095,30,MD,$5B to $10B ,"10,000+",Consulting and Business Services
120000-139999,130000,data_scientist,"Data Mining, Machine Learning, Hadoop, R, Perl, SAS, C/C++, Cloud Computing, Java, .Net, C#, SPSS, Python",13,1733,3.900000095,30,DC,$5B to $10B ,"10,000+",Consulting and Business Services
120000-139999,130000,data_scientist,"Biostatistics, Survival Analysis, Machine Learning, R, Natural Language Processing, Python",6,11,4.199999809,30,WA,,,
120000-139999,130000,data_scientist,"JavaScript, TensorFlow, Machine Learning, R, Image Processing, C/C++, SQL, .Net, Angular, C#, MATLAB, Python",12,3504,4,30,TX,less than $1B ,"10,000+",Industrial Manufacturing
120000-139999,130000,data_scientist,"AI, Business Intelligence, Machine Learning, Hadoop, R, Marketing, Statisical Analysis, SAS, SQL, Big Data, Predictive Analytics, Design Experience, Operations Research, Python",14,179,3.700000048,30,CA,,,
120000-139999,130000,data_scientist,"TensorFlow, AI, Data Mining, TS/SCI Clearance, Network",5,96,4.099999905,7,MA,,"less than 10,000",Aerospace and Defense
120000-139999,130000,data_scientist,"Data Mining, TS/SCI Clearance, Tableau, Splunk, Big Data, Spark, Docker, Data Analysis, Data Science",9,1733,3.900000095,30,VA,$5B to $10B ,"10,000+",Consulting and Business Services
120000-139999,130000,data_scientist,"Java, Hive, Spark, Machine Learning, Hadoop, NoSQL, Scripting, Python, Elasticsearch, Apache",10,,,15,VA,,,
120000-139999,130000,data_scientist,"Big Data, Machine Learning, R, SAS, Python, SQL",6,34,2.900000095,30,NC,,,Auto
120000-139999,130000,data_scientist,"Data Mining, TS/SCI Clearance, Tableau, Splunk, Big Data, Spark, Docker, Data Analysis, Data Science",9,1733,3.900000095,30,VA,$5B to $10B ,"10,000+",Consulting and Business Services
120000-139999,130000,data_scientist,"Data Mining, TS/SCI Clearance, Tableau, Splunk, Big Data, Spark, Docker, Data Analysis, Data Science",9,1733,3.900000095,30,VA,$5B to $10B ,"10,000+",Consulting and Business Services
120000-139999,130000,data_scientist,"Linux, Data Mining, Machine Learning, TS/SCI Clearance, Image Processing, Tableau, Splunk, Big Data, Natural Language Processing, Spark, Docker, Data Analysis",12,1733,3.900000095,18,MO,$5B to $10B ,"10,000+",Consulting and Business Services
120000-139999,130000,data_scientist,"TensorFlow, Java, AI, MySQL, Spark, R, Scala, Python, SQL",9,,,30,TX,,,
120000-139999,130000,data_scientist,"Hive, Microsoft SQL Server, R, Perl, SQL, Big Data, PHP, AI, Quantitative Analysis, Data Mining, Scripting, Hadoop, SAS, Oracle, Cassandra, Spark, Python, DB2",18,157456,3.599999905,25,AR,more than $10B ,"10,000+",Retail
120000-139999,130000,data_scientist,"Machine Learning, Scala, Solr, Java, Lucene, Natural Language Processing, Python, SPARQL, Elasticsearch",9,14629,3.900000095,30,NY,more than $10B ,"10,000+",Banks and Financial Services
120000-139999,130000,data_scientist,"Pig, AI, Hive, Ruby, Machine Learning, Hadoop, Project Management, R, SAP, SAS, Clojure, Java, Design Experience, MATLAB, Python, PHP",16,6415,4.099999905,30,TX,more than $10B ,"10,000+",Aerospace and Defense
120000-139999,130000,data_scientist,"Pig, AI, Hive, Ruby, Machine Learning, Hadoop, Project Management, R, SAP, SAS, Clojure, Java, Design Experience, MATLAB, Python, PHP",16,6415,4.099999905,30,TX,more than $10B ,"10,000+",Aerospace and Defense
120000-139999,130000,data_scientist,"Spark, Machine Learning, QlikView, Hadoop, R, Oracle, Python, Tableau",8,,,20,NC,,,
120000-139999,130000,data_scientist,"AI, Microsoft SQL Server, R, MySQL, PostgreSQL, Leadership Experience, Data Science, OOP, Python, PHP",10,195,3.799999952,30,GA,more than $10B ,"10,000+",Industrial Manufacturing
120000-139999,130000,data_scientist,"Hive, Machine Learning, Data Management, Hadoop, R, Python",6,3656,3.799999952,30,CA,more than $10B ,"10,000+",Insurance
120000-139999,130000,data_scientist,"TensorFlow, Java, AI, Machine Learning, MATLAB, Python",6,6,4,30,CA,,,
120000-139999,130000,data_scientist,"Machine Learning, Python, SQL, AWS",4,,,21,MA,,,
120000-139999,130000,data_scientist,"Java, Big Data, Hive, Spark, Machine Learning, Hadoop, R, Scala, Statisical Analysis, Python, SQL",11,209,3.900000095,30,IL,,"less than 10,000",Internet and Software
120000-139999,130000,data_scientist,"Machine Learning, Pentaho, Hadoop, R, Weka, SAS, Data Analysis, Data Science",8,494,3.799999952,12,PA,,,
120000-139999,130000,data_scientist,"Machine Learning, Experimental Design, Hadoop, R, SQL, Spark, NoSQL, Python, GIS",9,,,30,CA,,,
120000-139999,130000,data_scientist,"Big Data, Hive, Spark, Hadoop, R, Python, SQL",7,641,3.799999952,30,CA,,"10,000+",Internet and Software
120000-139999,130000,data_scientist,"TensorFlow, Natural Language Processing, Machine Learning, Docker, Python, AWS",6,,,30,CA,$5B to $10B ,"10,000+",Restaurants and Travel and Leisure
120000-139999,130000,data_scientist,"Pig, Hive, Machine Learning, Azure, R, Big Data, Kubernetes, GIS, Data Mining, Hadoop, Scala, CI/CD, HBase, Tableau, Java, Cassandra, MongoDB, Spark, Git",19,92,3.799999952,30,CA,$1B to $5B ,"less than 10,000",Internet and Software
120000-139999,130000,data_scientist,"Java, Natural Language Processing, Machine Learning, Image Processing, Python",5,252,3.700000048,30,CA,,"less than 10,000",Internet and Software
120000-139999,130000,data_scientist,"AI, Hive, Data Mining, Machine Learning, Hadoop, R, Scala, SQL, Spark, Python",10,,,30,CA,,,
120000-139999,130000,data_scientist,"R, Python, SQL",3,,,30,NY,,,
120000-139999,130000,data_scientist,"Hive, Data Mining, Machine Learning, Hadoop, Marketing, Sentiment Analytics, SQL, Python",8,21159,3.900000095,30,DE,more than $10B ,"10,000+",Banks and Financial Services
120000-139999,130000,data_scientist,"Linux, Microsoft SQL Server, Machine Learning, R, C/C++, SQL, S3, MySQL, Data Analysis, PostgreSQL, Leadership Experience, Google AdWords, Hadoop, Scala, Tableau, Java, MongoDB, Spark, Facebook Advertising, REST",20,,,30,USA,,,
120000-139999,130000,data_scientist,"Data Mining, Machine Learning, SQL, Tableau, Natural Language Processing, Python, Data Science",7,72,3.200000048,26,OR,,,Banks and Financial Services
120000-139999,130000,data_scientist,"Machine Learning, R, Python, SQL",4,,,30,CA,,,
120000-139999,130000,data_scientist,"Natural Language Processing, Data Mining, Machine Learning, Go, Python",5,,,2,CA,,,
120000-139999,130000,data_scientist,"Data Mining, Machine Learning, Hadoop, R, Tableau, Natural Language Processing, Confluence, NoSQL, Python, Jira",10,56,4.099999905,5,CA,,"less than 10,000",Internet and Software
120000-139999,130000,data_scientist,"TS/SCI Clearance, Data Analysis, GIS",3,24,4.099999905,30,DC,,,
120000-139999,130000,data_scientist,"TensorFlow, JavaScript, Data Mining, Machine Learning, Marketing, R, Google Cloud Platform, Azure, HTML5, Web Development, Python, AWS",12,369,3.599999905,12,AZ,$1B to $5B ,"less than 10,000",Internet and Software
120000-139999,130000,data_scientist,"TensorFlow, Big Data, S3, Spark, Machine Learning, Scala, Kafka, Python, AWS",9,,,30,NY,,,
120000-139999,130000,data_scientist,"TensorFlow, Hive, Data Mining, Machine Learning, Hadoop, Kafka, Scala, R, SQL, Java, Natural Language Processing, Spark, Python",13,21,4,30,MI,,"less than 10,000",Insurance
120000-139999,130000,data_scientist,"Data Mining, Machine Learning, Marketing Automation, Data Science",4,,,30,MA,,,
120000-139999,130000,data_scientist,"Machine Learning, R, SQL, Apache, S3, Hadoop, Kafka, Scala, Marketing, SAS, Java, Spark, Python, AWS",14,259,3.400000095,30,USA,,,
120000-139999,130000,data_scientist,"TensorFlow, Machine Learning, R, SQL, Excel, Big Data, Natural Language Processing, Spark, SPSS, Python",10,23472,3.900000095,30,NY,,"10,000+",Consulting and Business Services
120000-139999,130000,data_scientist,"TensorFlow, Hive, Spark, Machine Learning, Software Development",5,,,18,CA,,,
120000-139999,130000,data_scientist,"Data Mining, Machine Learning, Scripting, Project Management, R, SAS, SQL, Tableau, QlikView, Python",10,264,3.5,30,NC,,"10,000+",Health Care
120000-139999,130000,data_scientist,"Spark, Machine Learning, Hadoop, R, Python, SQL",6,5,4.800000191,30,WA,,,
120000-139999,130000,data_scientist,"Ruby, Machine Learning, Perl, Java, Python",5,2174,4,12,TX,more than $10B ,"10,000+",Insurance
120000-139999,130000,data_scientist,"Natural Language Processing, Machine Learning, Microsoft Powerpoint",3,1472,3.900000095,15,IL,,,Health Care
120000-139999,130000,data_scientist,"Java, Natural Language Processing, Machine Learning, Scala",4,32,3.599999905,30,CA,$1B to $5B ,"less than 10,000",
120000-139999,130000,data_scientist,"Linux, Machine Learning, Hadoop, Scala, R, C/C++, Java, MongoDB, Spark, Data Analysis, Data Science, Python",12,3285,4.099999905,30,IL,more than $10B ,"10,000+",Health Care
120000-139999,130000,data_scientist,"Machine Learning, Scripting, Python, SQL",4,,,30,CA,,,
120000-139999,130000,data_scientist,"TensorFlow, Big Data, S3, Spark, Machine Learning, Scala, Kafka, Python, AWS",9,9,3,30,NY,,,
120000-139999,130000,data_scientist,"Hive, Machine Learning, Data Management, Hadoop, R, Python",6,3656,3.799999952,30,NY,more than $10B ,"10,000+",Insurance
120000-139999,130000,data_scientist,"JavaScript, TensorFlow, Linux, Machine Learning, Hadoop, R, SQL, Tableau, Spark, Data Science, Python",11,182,3.900000095,30,MA,,"less than 10,000",Pharmaceuticals
120000-139999,130000,data_scientist,"JavaScript, TensorFlow, Linux, Machine Learning, Hadoop, R, SQL, Tableau, Spark, Data Science, Python",11,182,3.900000095,30,MA,,"less than 10,000",Pharmaceuticals
120000-139999,130000,data_scientist,"Machine Learning, R, C/C++, S3, MATLAB, OOP, SVN, Design Patterns, Hadoop, Java, Spark, Git, Signal Processing, Python, AWS",15,781,3.700000048,30,MA,,,Energy and Utilities
120000-139999,130000,data_scientist,"Pig, Hive, Machine Learning, R, C/C++, Apache, Splunk, Big Data, Design Experience, Scripting, Hadoop, Scala, Kafka, Tableau, Java, Spark, Docker, Operations Research, Python",19,1733,3.900000095,15,OH,$5B to $10B ,"10,000+",Consulting and Business Services
120000-139999,130000,data_scientist,"Pig, Hive, Machine Learning, R, C/C++, Apache, Splunk, Big Data, Design Experience, Scripting, Hadoop, Scala, Kafka, Tableau, Java, Spark, Docker, Operations Research, Python",19,1733,3.900000095,15,OH,$5B to $10B ,"10,000+",Consulting and Business Services
120000-139999,130000,data_scientist,"Hive, Microsoft SQL Server, R, C/C++, SQL, Big Data, Leadership Experience, AI, Data Mining, Hadoop, Scala, SAS, Oracle, Java, Cassandra, Spark, Python, DB2",18,157456,3.599999905,30,AR,more than $10B ,"10,000+",Retail
120000-139999,130000,data_scientist,"Java, Pig, Hive, Spark, Machine Learning, Hadoop, Scala, Python, SQL",9,30,4.300000191,30,CO,,"less than 10,000",Internet and Software
120000-139999,130000,data_scientist,"Natural Language Processing, Hive, Spark, Machine Learning, Image Processing, Python, SQL",7,67,4.099999905,30,MA,,"less than 10,000",Internet and Software
120000-139999,130000,data_scientist,"AI, Data Mining, Quantitative Analysis, Machine Learning, R, SAS, Tableau, Big Data, Data Warehouse, Python",10,,,12,MD,more than $10B ,"10,000+",Consulting and Business Services
120000-139999,130000,data_scientist,"AI, Data Mining, Machine Learning, Hadoop, Azure, R, Scala, SQL, .Net, Spark, C#, Data Analysis, Data Science, Python",14,5178,4.199999809,30,WA,more than $10B ,"10,000+",Internet and Software
120000-139999,130000,data_scientist,"Pig, Hive, Machine Learning, Conversion Optimization, C/C++, SaaS, Data Analysis, Data Mining, Scala, Tableau, Java, Spark, Python",13,43,3,30,CA,,,
120000-139999,130000,data_scientist,"Hive, Business Intelligence, Data Mining, Machine Learning, Hadoop, R, Scala, Statisical Analysis, SAS, C/C++, SQL, Tableau, Java, MySQL, Spark, Data Warehouse, Python, Data Science",18,2900,3.900000095,30,NY,more than $10B ,"10,000+",Banks and Financial Services
120000-139999,130000,data_scientist,"Machine Learning, Power BI, R, SQL, Tableau, QlikView, Python",7,9,3.799999952,30,MI,,"less than 10,000",Consulting and Business Services
120000-139999,130000,data_scientist,"Pig, Hive, Machine Learning, R, Azure, Sentiment Analytics, SQL, Big Data, Natural Language Processing, S3, PostgreSQL, MATLAB, Statistical Software, Data Mining, Microsoft Powerpoint, Hadoop, SAP, SAS, MongoDB, Spark",20,6072,3.799999952,9,CA,,"10,000+",Consulting and Business Services
120000-139999,130000,data_scientist,"Data Mining, Project Management, R, SAS, SQL, Data Science",6,57,3.599999905,20,NJ,,,Insurance
120000-139999,130000,data_scientist,"Machine Learning, Natural Language Processing, Git, Python",4,140,3.700000048,30,PA,,,Pharmaceuticals
120000-139999,130000,data_scientist,"Data Mining, Machine Learning, Project Management, R, SAS, SQL, Financial Modeling",7,14629,3.900000095,30,GA,more than $10B ,"10,000+",Banks and Financial Services
120000-139999,130000,data_scientist,"Linux, Data Mining, TS/SCI Clearance, Hadoop, R, Tableau, Splunk, Big Data, Spark, Docker, Data Analysis, Python",12,1733,3.900000095,5,MD,$5B to $10B ,"10,000+",Consulting and Business Services
120000-139999,130000,data_scientist,"Predictive Analytics, Machine Learning, R, Scala, Python, C/C++, SQL",7,411,4.300000191,30,MA,,,
120000-139999,130000,data_scientist,"PMP, Data Mining, R, Distributed Control Systems, Statisical Analysis, SQL, Spark, Python",8,252,3.700000048,30,CA,,"less than 10,000",Internet and Software
120000-139999,130000,data_scientist,"Hive, Data Mining, Machine Learning, Hadoop, SAS, Sentiment Analytics, SQL, Tableau",8,21159,3.900000095,30,DE,more than $10B ,"10,000+",Banks and Financial Services
120000-139999,130000,data_scientist,"Confluence, TS/SCI Clearance, Jira, AWS",4,12,3.900000095,30,USA,,,
120000-139999,130000,data_scientist,"Machine Learning, Git, R, Python, SVN",5,,,30,DC,,,
120000-139999,130000,data_scientist,"TensorFlow, Linux, Machine Learning, Hadoop, Network, R, SQL, Java, Natural Language Processing, Spark, Python",11,23472,3.900000095,13,USA,,"10,000+",Consulting and Business Services
120000-139999,130000,data_scientist,"Hive, Microsoft SQL Server, R, Perl, SQL, Big Data, PHP, AI, Quantitative Analysis, Data Mining, Scripting, Hadoop, SAS, Oracle, Cassandra, Spark, Python, DB2",18,157456,3.599999905,30,AR,more than $10B ,"10,000+",Retail
120000-139999,130000,data_scientist,"TensorFlow, Hadoop, Scala, SQL, Spark, Python",6,,,30,CA,,,
120000-139999,130000,data_scientist,"Big Data, AI, Machine Learning",3,5178,4.199999809,30,WA,more than $10B ,"10,000+",Internet and Software
120000-139999,130000,data_scientist,"Java, Natural Language Processing, Machine Learning, Image Processing, Python",5,157456,3.599999905,30,CA,more than $10B ,"10,000+",Retail
120000-139999,130000,data_scientist,"Hadoop, Project Management, R, SAS, SQL, Tableau, Alteryx, Python, AWS",9,6574,4.199999809,30,OR,more than $10B ,"10,000+",Consumer Goods and Services
120000-139999,130000,data_scientist,"TensorFlow, Linux, Mesos, Machine Learning, CI/CD, Big Data, Spark, Kubernetes, Git, Docker, Python, Data Science, Jenkins",13,,,1,VA,,,
120000-139999,130000,data_scientist,"Machine Learning, Microsoft Powerpoint, Project Management, R, Scala, SAS, C/C++, .Net, Java, C#, SPSS, MATLAB, Data Science, Python",14,2348,3.900000095,30,NJ,more than $10B ,"10,000+",Banks and Financial Services
120000-139999,130000,data_scientist,"Java, Natural Language Processing, Machine Learning, Image Processing, Python",5,157456,3.599999905,30,CA,more than $10B ,"10,000+",Retail
120000-139999,130000,data_scientist,"Machine Learning, Hadoop, Weka, R, HBase, MySQL, MATLAB",7,157456,3.599999905,30,CA,more than $10B ,"10,000+",Retail
120000-139999,130000,data_scientist,"TensorFlow, Machine Learning, Hadoop, R, Tableau, Splunk, Big Data, Natural Language Processing, MongoDB, Spark, Docker, Python, Elasticsearch, AWS",14,1733,3.900000095,30,AL,$5B to $10B ,"10,000+",Consulting and Business Services
120000-139999,130000,data_scientist,"MySQL, Hadoop, Weka, R, MATLAB, HBase",6,157456,3.599999905,30,CA,more than $10B ,"10,000+",Retail
120000-139999,130000,data_scientist,"Data Mining, R, SAS, SQL",4,1629,3.900000095,30,CA,,"10,000+",Insurance
120000-139999,130000,data_scientist,"ArcGIS, Statisical Analysis, Python, GIS, SQL",5,17,3.400000095,30,CA,,,
120000-139999,130000,data_scientist,"Spark, Machine Learning, Docker, Hadoop, R, Python, SQL",7,,,30,OH,,,
120000-139999,130000,data_scientist,"TensorFlow, Machine Learning, Hadoop, Java, Python, AWS",6,2914,3.700000048,30,MA,more than $10B ,"10,000+",Insurance
120000-139999,130000,data_scientist,"TS/SCI Clearance, SAS, SQL",3,1733,3.900000095,26,VA,$5B to $10B ,"10,000+",Consulting and Business Services
120000-139999,130000,data_scientist,"Machine Learning, Hadoop, Weka, R, MySQL, MATLAB",6,157456,3.599999905,30,AR,more than $10B ,"10,000+",Retail
120000-139999,130000,data_scientist,"Data Mining, Machine Learning, Qualtrics, R, SQL, Tableau, Big Data, Python",8,17,4.300000191,30,WA,,"less than 10,000",Internet and Software
120000-139999,130000,data_scientist,"Hive, Machine Learning, R, C/C++, SQL, S3, MATLAB, Data Mining, Hadoop, SAP, SAS, Tableau, Java, Spark, Data Science, Python, AWS",17,144,3.599999905,18,CA,less than $1B ,"less than 10,000",Health Care
120000-139999,130000,data_scientist,"R, Python, SQL",3,35,4.300000191,30,NY,,"less than 10,000",Internet and Software
120000-139999,130000,data_scientist,"R, SAS, Python",3,1830,3.799999952,30,IL,more than $10B ,"10,000+",Banks and Financial Services
120000-139999,130000,data_scientist,"TensorFlow, Machine Learning, Python, SQL",4,,,27,CA,,,
120000-139999,130000,data_scientist,"Pig, Statistical Software, Hive, Data Mining, Ruby, Machine Learning, Hadoop, Kafka, Scala, HBase, Big Data, Java, Spark, Python, Elasticsearch",15,18164,3.900000095,1,TN,more than $10B ,"10,000+",Transport and Freight
120000-139999,130000,data_scientist,"Machine Learning, R, C/C++, S3, MATLAB, OOP, SVN, Design Patterns, Hadoop, Java, Spark, Git, Signal Processing, Python, AWS",15,781,3.700000048,30,MA,,,Energy and Utilities
120000-139999,130000,data_scientist,"Machine Learning, Project Management, Scripting, Hadoop, R, Project Engineering, SQL, Design Experience, NoSQL, MATLAB, Process Engineering, Python",12,,,30,NY,,,
120000-139999,130000,data_scientist,"Pig, AI, Hive, Quantitative Analysis, Data Mining, Hadoop, R, Perl, C/C++, Microsoft Office, SQL, Java, .Net, Spark, C#, MATLAB, Python",17,5178,4.199999809,30,WA,more than $10B ,"10,000+",Internet and Software
120000-139999,130000,data_scientist,"R, SAS, SQL, SPSS, Python",5,23472,3.900000095,30,NY,,"10,000+",Consulting and Business Services
120000-139999,130000,data_scientist,"Hive, SQL, Tableau",3,1103,4.199999809,30,CA,$1B to $5B ,"less than 10,000",Internet and Software
120000-139999,130000,data_scientist,"JavaScript, Chef, Linux, Embedded Software, VMWare, Network, Apache, OpenStack, Docker, Shell Scripting, Python, TCP/IP, TCP",13,4,3.799999952,30,WA,,,
120000-139999,130000,data_scientist,"Machine Learning, Hadoop, R, Scala, Google Cloud Platform, SAS, SQL, Tableau, Spark, SPSS, QlikView, Python",12,,,30,NY,,,
120000-139999,130000,data_scientist,"Pig, Hive, Microsoft SQL Server, Machine Learning, Hadoop, Weka, SQL, Java, MySQL, Cassandra, MATLAB, Python",12,,,30,MN,,,
120000-139999,130000,data_scientist,"AI, Machine Learning, R, Marketing, Scala, SQL, Big Data, Spark, Python",9,2066,3.799999952,12,MA,,"10,000+",Consulting and Business Services
120000-139999,130000,data_scientist,"Hadoop, Project Management, R, SAS, SQL, Tableau, Alteryx, Python, AWS",9,6574,4.199999809,16,OR,more than $10B ,"10,000+",Consumer Goods and Services
120000-139999,130000,data_scientist,"Hive, Spark, Machine Learning, Hadoop, Python, SQL",6,157456,3.599999905,30,CA,more than $10B ,"10,000+",Retail
120000-139999,130000,data_scientist,,0,,,19,WA,,"10,000+",Internet and Software
120000-139999,130000,data_scientist,"Java, Natural Language Processing, AI, Machine Learning, Hadoop, Perl, C/C++, Python",8,,,30,MA,,,
120000-139999,130000,data_scientist,"TensorFlow, Machine Learning, Software Troubleshooting, Scripting, Hadoop, R, Perl, C/C++, SQL, Big Data, Spark, NoSQL, MATLAB, Python",14,8696,4,30,NC,more than $10B ,"10,000+",Computers and Electronics
120000-139999,130000,data_scientist,"Data Mining, Machine Learning, Project Management, R, Change Management, Natural Language Processing, S3, MATLAB, Python, AWS",10,10824,4,30,TX,more than $10B ,"10,000+",Computers and Electronics
120000-139999,130000,data_scientist,"Data Mining, Machine Learning, Project Management, R, SAS, SQL, Python",7,6037,4.199999809,30,USA,more than $10B ,"10,000+",Banks and Financial Services
120000-139999,130000,data_scientist,,0,1103,4.199999809,30,CA,$1B to $5B ,"less than 10,000",Internet and Software
120000-139999,130000,data_scientist,"Data Mining, Machine Learning, R, SAS, Python",5,4686,3.700000048,30,KY,more than $10B ,"10,000+",Health Care
120000-139999,130000,data_scientist,"AI, Data Mining, Machine Learning, R, Image Processing, Qualitative Research, Natural Language Processing, Python",8,30,3.700000048,30,CA,,,
120000-139999,130000,data_scientist,"Google AdWords, Hive, Microsoft SQL Server, Machine Learning, R, SQL, JSON, Tableau, Data Analysis, Python",10,80,4,30,WA,less than $1B ,"less than 10,000",Real Estate
120000-139999,130000,data_scientist,"NIST, TS/SCI Clearance",2,,,30,DC,,,
120000-139999,130000,data_scientist,"Data Mining, Machine Learning, R, Azure, SDLC, SAS, Cloud Computing, Tableau, Alteryx, Spark, Git, MATLAB, Python, AWS",14,,,29,TX,,,
120000-139999,130000,data_scientist,"TensorFlow, Pig, Hive, Data Mining, Machine Learning, Hadoop, Perl, R, SAS, C/C++, Big Data, Java, .Net, C#, MATLAB, Data Science, Python",17,656,4,30,TX,more than $10B ,"10,000+",Banks and Financial Services
120000-139999,130000,data_scientist,"TensorFlow, Natural Language Processing, AI, Data Mining, Python",5,1208,3.799999952,30,NJ,,"less than 10,000",Consulting and Business Services
120000-139999,130000,data_scientist,"Data Mining, Machine Learning, R, Python, SQL",5,1791,4.300000191,30,CA,more than $10B ,"10,000+",Internet and Software
120000-139999,130000,data_scientist,"Linux, Machine Learning, R, SQL, Big Data, Natural Language Processing, Hadoop, Tableau, Git, NoSQL, Python",11,3164,4.099999905,30,MA,more than $10B ,"10,000+",Pharmaceuticals
120000-139999,130000,data_scientist,"Machine Learning, Data Management",2,4683,4,30,DC,more than $10B ,"10,000+",Industrial Manufacturing
120000-139999,130000,data_scientist,"TensorFlow, Data Mining, Machine Learning, Image Processing, Statisical Analysis, Big Data, Natural Language Processing, Spark, Signal Processing, Python, AWS",11,982,3.799999952,30,WI,$5B to $10B ,"less than 10,000",Insurance
120000-139999,130000,data_scientist,"Natural Language Processing, Supervising Experience, Google Cloud Platform, AWS",4,261,4.099999905,30,MA,,,Health Care
120000-139999,130000,data_scientist,"Hive, Data Mining, Machine Learning, Hadoop, R, C/C++, HTML5, Java, Python",9,3526,4.300000191,30,NJ,more than $10B ,"10,000+",Pharmaceuticals
120000-139999,130000,data_scientist,"Hive, Data Mining, Machine Learning, Hadoop, R, C/C++, HTML5, Java, Python",9,3526,4.300000191,30,NJ,more than $10B ,"10,000+",Pharmaceuticals
120000-139999,130000,data_scientist,"Hive, Data Mining, Machine Learning, Hadoop, R, C/C++, HTML5, Java, Python",9,3526,4.300000191,30,NJ,more than $10B ,"10,000+",Pharmaceuticals
120000-139999,130000,data_scientist,"Hive, Data Mining, Machine Learning, Hadoop, R, Scala, Oracle, SAS, C/C++, SQL, Tableau, Teradata, Java, MySQL, SPSS, MATLAB, Business Analysis, Python",18,4251,4.099999905,19,NC,more than $10B ,"10,000+",Internet and Software
120000-139999,130000,data_scientist,"Natural Language Processing, AI, Machine Learning, R",4,7,4,12,IL,,,
120000-139999,130000,data_scientist,"AI, Data Mining, Machine Learning, SQL, Natural Language Processing, NoSQL, Python, AWS",8,717,4.199999809,30,MA,,,Computers and Electronics
120000-139999,130000,data_scientist,"TensorFlow, Natural Language Processing, Data Management, Docker, Image Processing, Python",6,4683,4,20,CA,more than $10B ,"10,000+",Industrial Manufacturing
120000-139999,130000,data_scientist,"AI, Hive, Machine Learning, Google Analytics, Hadoop, Project Management, R, Big Data, Python",9,14629,3.900000095,30,SC,more than $10B ,"10,000+",Banks and Financial Services
120000-139999,130000,data_scientist,"Hive, Hadoop, R, SQL, Spark, Leadership Experience, Python",7,21159,3.900000095,19,DE,more than $10B ,"10,000+",Banks and Financial Services
120000-139999,130000,data_scientist,"AI, Information Security, Data Mining, Machine Learning, Scripting",5,6574,4.199999809,30,OR,more than $10B ,"10,000+",Consumer Goods and Services
